PassengerId,Survived,Pclass,Name,Sex,Age,Companions,Family,Ticket,Fare,Station,Coach
808,0,3,"Pettersson, Miss. Ellen Natalia",female,18.0,0,0,347087,2410.68,New Delhi Junction (NDLS),3AC
809,0,2,"Meyer, Mr. August",male,39.0,0,0,248723,3286.09,New Delhi Junction (NDLS),2AC
810,1,1,"Chambers, Mrs. Norman Campbell (Bertha Griggs)",female,33.0,1,0,113806,4935.89,New Delhi Junction (NDLS),1AC
811,0,3,"Alexander, Mr. William",male,26.0,0,0,3474,2481.81,New Delhi Junction (NDLS),3AC
812,0,3,"Lester, Mr. James",male,39.0,0,0,A/4 48871,2306.68,New Delhi Junction (NDLS),3AC
813,0,2,"Slemen, Mr. Richard James",male,35.0,0,0,28206,2862.06,New Delhi Junction (NDLS),2AC
814,0,3,"Andersson, Miss. Ebba Iris Alfrida",female,6.0,4,2,347082,2405.01,New Delhi Junction (NDLS),3AC
815,0,3,"Tomlin, Mr. Ernest Portage",male,30.5,0,0,364499,2343.88,New Delhi Junction (NDLS),3AC
816,0,1,"Fry, Mr. Richard",male,,0,0,112058,5422.61,New Delhi Junction (NDLS),1AC
817,0,3,"Heininen, Miss. Wendla Maria",female,23.0,0,0,STON/O2. 3101290,2009.53,New Delhi Junction (NDLS),3AC
818,0,2,"Mallet, Mr. Albert",male,31.0,1,1,S.C./PARIS 2079,3218.7,Mumbai Central (BCT),2AC
819,0,3,"Holm, Mr. John Fredrik Alexander",male,43.0,0,0,C 7075,1365.71,New Delhi Junction (NDLS),3AC
820,0,3,"Skoog, Master. Karl Thorsten",male,10.0,3,2,347088,1702.24,New Delhi Junction (NDLS),3AC
821,1,1,"Hays, Mrs. Charles Melville (Clara Jennings Gregg)",female,52.0,1,1,12749,5763.42,New Delhi Junction (NDLS),1AC
822,1,3,"Lulic, Mr. Nikola",male,27.0,0,0,315098,1305.56,New Delhi Junction (NDLS),3AC
823,0,1,"Reuchlin, Jonkheer. John George",male,38.0,0,0,19972,5200.2,New Delhi Junction (NDLS),1AC
824,1,3,"Moor, Mrs. (Beila)",female,27.0,0,1,392096,1777.8,New Delhi Junction (NDLS),3AC
825,0,3,"Panula, Master. Urho Abraham",male,2.0,4,1,3101295,1944.87,New Delhi Junction (NDLS),3AC
826,0,3,"Flynn, Mr. John",male,,0,0,368323,2403.83,Chennai Central (MAS),3AC
827,0,3,"Lam, Mr. Len",male,,0,0,1601,1715.62,New Delhi Junction (NDLS),3AC
828,1,2,"Mallet, Master. Andre",male,1.0,0,2,S.C./PARIS 2079,3151.04,Mumbai Central (BCT),2AC
829,1,3,"McCormack, Mr. Thomas Joseph",male,,0,0,367228,2185.0,Chennai Central (MAS),3AC
830,1,1,"Stone, Mrs. George Nelson (Martha Evelyn)",female,62.0,0,0,113572,5342.66,,1AC
831,1,3,"Yasbeck, Mrs. Antoni (Selini Alexander)",female,15.0,1,0,2659,1569.53,Mumbai Central (BCT),3AC
832,1,2,"Richards, Master. George Sibley",male,0.83,1,1,29106,3288.17,New Delhi Junction (NDLS),2AC
833,0,3,"Saad, Mr. Amin",male,,0,0,2671,1469.03,Mumbai Central (BCT),3AC
834,0,3,"Augustsson, Mr. Albert",male,23.0,0,0,347468,1511.66,New Delhi Junction (NDLS),3AC
835,0,3,"Allum, Mr. Owen George",male,18.0,0,0,2223,1898.04,New Delhi Junction (NDLS),3AC
836,1,1,"Compton, Miss. Sara Rebecca",female,39.0,1,1,PC 17756,5302.71,Mumbai Central (BCT),1AC
837,0,3,"Pasic, Mr. Jakob",male,21.0,0,0,315097,2397.82,New Delhi Junction (NDLS),3AC
838,0,3,"Sirota, Mr. Maurice",male,,0,0,392092,1734.87,New Delhi Junction (NDLS),3AC
839,1,3,"Chip, Mr. Chang",male,32.0,0,0,1601,1996.71,New Delhi Junction (NDLS),3AC
840,1,1,"Marechal, Mr. Pierre",male,,0,0,11774,5558.72,Mumbai Central (BCT),1AC
841,0,3,"Alhomaki, Mr. Ilmari Rudolf",male,20.0,0,0,SOTON/O2 3101287,1315.71,New Delhi Junction (NDLS),3AC
842,0,2,"Mudd, Mr. Thomas Charles",male,16.0,0,0,S.O./P.P. 3,3562.6,New Delhi Junction (NDLS),2AC
843,1,1,"Serepeca, Miss. Augusta",female,30.0,0,0,113798,5013.64,Mumbai Central (BCT),1AC
844,0,3,"Lemberopolous, Mr. Peter L",male,34.5,0,0,2683,2453.28,Mumbai Central (BCT),3AC
845,0,3,"Culumovic, Mr. Jeso",male,17.0,0,0,315090,1478.4,New Delhi Junction (NDLS),3AC
846,0,3,"Abbing, Mr. Anthony",male,42.0,0,0,C.A. 5547,1797.55,New Delhi Junction (NDLS),3AC
847,0,3,"Sage, Mr. Douglas Bullen",male,,8,2,CA. 2343,1402.42,New Delhi Junction (NDLS),3AC
848,0,3,"Markoff, Mr. Marin",male,35.0,0,0,349213,2496.25,Mumbai Central (BCT),3AC
849,0,2,"Harper, Rev. John",male,28.0,0,1,248727,3352.85,New Delhi Junction (NDLS),2AC
850,1,1,"Goldenberg, Mrs. Samuel L (Edwiga Grabowska)",female,,1,0,17453,5514.46,Mumbai Central (BCT),1AC
851,0,3,"Andersson, Master. Sigvard Harald Elias",male,4.0,4,2,347082,1380.49,New Delhi Junction (NDLS),3AC
852,0,3,"Svensson, Mr. Johan",male,74.0,0,0,347060,2199.95,New Delhi Junction (NDLS),3AC
853,0,3,"Boulos, Miss. Nourelain",female,9.0,1,1,2678,1551.89,Mumbai Central (BCT),3AC
854,1,1,"Lines, Miss. Mary Conover",female,16.0,0,1,PC 17592,5877.67,New Delhi Junction (NDLS),1AC
855,0,2,"Carter, Mrs. Ernest Courtenay (Lilian Hughes)",female,44.0,1,0,244252,2966.68,New Delhi Junction (NDLS),2AC
856,1,3,"Aks, Mrs. Sam (Leah Rosen)",female,18.0,0,1,392091,1528.83,New Delhi Junction (NDLS),3AC
857,1,1,"Wick, Mrs. George Dennick (Mary Hitchcock)",female,45.0,1,1,36928,4843.86,New Delhi Junction (NDLS),1AC
858,1,1,"Daly, Mr. Peter Denis ",male,51.0,0,0,113055,5366.48,New Delhi Junction (NDLS),1AC
859,1,3,"Baclini, Mrs. Solomon (Latifa Qurban)",female,24.0,0,3,2666,1977.81,Mumbai Central (BCT),3AC
860,0,3,"Razi, Mr. Raihed",male,,0,0,2629,1378.85,Mumbai Central (BCT),3AC
861,0,3,"Hansen, Mr. Claus Peter",male,41.0,2,0,350026,2230.63,New Delhi Junction (NDLS),3AC
862,0,2,"Giles, Mr. Frederick Edward",male,21.0,1,0,28134,3289.28,New Delhi Junction (NDLS),2AC
863,1,1,"Swift, Mrs. Frederick Joel (Margaret Welles Barron)",female,48.0,0,0,17466,5429.27,New Delhi Junction (NDLS),1AC
864,0,3,"Sage, Miss. Dorothy Edith ""Dolly""",female,,8,2,CA. 2343,1828.92,New Delhi Junction (NDLS),3AC
865,0,2,"Gill, Mr. John William",male,24.0,0,0,233866,3220.99,New Delhi Junction (NDLS),2AC
866,1,2,"Bystrom, Mrs. (Karolina)",female,42.0,0,0,236852,3427.53,New Delhi Junction (NDLS),2AC
867,1,2,"Duran y More, Miss. Asuncion",female,27.0,1,0,SC/PARIS 2149,2901.81,Mumbai Central (BCT),2AC
868,0,1,"Roebling, Mr. Washington Augustus II",male,31.0,0,0,PC 17590,5018.31,New Delhi Junction (NDLS),1AC
869,0,3,"van Melkebeke, Mr. Philemon",male,,0,0,345777,2334.14,New Delhi Junction (NDLS),3AC
870,1,3,"Johnson, Master. Harold Theodor",male,4.0,1,1,347742,2435.34,New Delhi Junction (NDLS),3AC
871,0,3,"Balkic, Mr. Cerin",male,26.0,0,0,349248,1747.97,New Delhi Junction (NDLS),3AC
872,1,1,"Beckwith, Mrs. Richard Leonard (Sallie Monypeny)",female,47.0,1,1,11751,5124.89,New Delhi Junction (NDLS),1AC
873,0,1,"Carlsson, Mr. Frans Olof",male,33.0,0,0,695,5572.8,New Delhi Junction (NDLS),1AC
874,0,3,"Vander Cruyssen, Mr. Victor",male,47.0,0,0,345765,1790.48,New Delhi Junction (NDLS),3AC
875,1,2,"Abelson, Mrs. Samuel (Hannah Wizosky)",female,28.0,1,0,P/PP 3381,2733.0,Mumbai Central (BCT),2AC
876,1,3,"Najib, Miss. Adele Kiamie ""Jane""",female,15.0,0,0,2667,1487.38,Mumbai Central (BCT),3AC
877,0,3,"Gustafsson, Mr. Alfred Ossian",male,20.0,0,0,7534,2159.17,New Delhi Junction (NDLS),3AC
878,0,3,"Petroff, Mr. Nedelio",male,19.0,0,0,349212,2090.71,New Delhi Junction (NDLS),3AC
879,0,3,"Laleff, Mr. Kristo",male,,0,0,349217,1332.52,New Delhi Junction (NDLS),3AC
880,1,1,"Potter, Mrs. Thomas Jr (Lily Alexenia Wilson)",female,56.0,0,1,11767,5066.37,Mumbai Central (BCT),1AC
881,1,2,"Shelley, Mrs. William (Imanita Parrish Hall)",female,25.0,0,1,230433,3000.4,New Delhi Junction (NDLS),2AC
882,0,3,"Markun, Mr. Johann",male,33.0,0,0,349257,2106.27,New Delhi Junction (NDLS),3AC
883,0,3,"Dahlberg, Miss. Gerda Ulrika",female,22.0,0,0,7552,1323.65,New Delhi Junction (NDLS),3AC
884,0,2,"Banfield, Mr. Frederick James",male,28.0,0,0,C.A./SOTON 34068,2835.34,New Delhi Junction (NDLS),2AC
885,0,3,"Sutehall, Mr. Henry Jr",male,25.0,0,0,SOTON/OQ 392076,2259.9,New Delhi Junction (NDLS),3AC
886,0,3,"Rice, Mrs. William (Margaret Norton)",female,39.0,0,5,382652,1514.25,Chennai Central (MAS),3AC
887,0,2,"Montvila, Rev. Juozas",male,27.0,0,0,211536,3548.57,New Delhi Junction (NDLS),2AC
888,1,1,"Graham, Miss. Margaret Edith",female,19.0,0,0,112053,5085.82,New Delhi Junction (NDLS),1AC
889,0,3,"Johnston, Miss. Catherine Helen ""Carrie""",female,,1,2,W./C. 6607,1419.33,New Delhi Junction (NDLS),3AC
890,1,1,"Behr, Mr. Karl Howell",male,26.0,0,0,111369,5091.81,Mumbai Central (BCT),1AC
891,0,3,"Dooley, Mr. Patrick",male,32.0,0,0,370376,2166.72,Chennai Central (MAS),3AC
