PassengerId,Survived,Pclass,Name,Sex,Age,Companions,Family,Ticket,Fare,Station,Coach
539,0,3,"Risien, Mr. Samuel Beard",male,,0,0,364498,1840.65,New Delhi Junction (NDLS),3AC
540,1,1,"Frolicher, Miss. Hedwig Margaritha",female,22.0,0,2,13568,4954.99,Mumbai Central (BCT),1AC
541,1,1,"Crosby, Miss. Harriet R",female,36.0,0,2,WE/P 5735,5944.86,New Delhi Junction (NDLS),1AC
542,0,3,"Andersson, Miss. Ingeborg Constanzia",female,9.0,4,2,347082,2027.41,New Delhi Junction (NDLS),3AC
543,0,3,"Andersson, Miss. Sigrid Elisabeth",female,11.0,4,2,347082,1574.37,New Delhi Junction (NDLS),3AC
544,1,2,"Beane, Mr. Edward",male,32.0,1,0,2908,3573.21,New Delhi Junction (NDLS),2AC
545,0,1,"Douglas, Mr. Walter Donald",male,50.0,1,0,PC 17761,5541.75,Mumbai Central (BCT),1AC
546,0,1,"Nicholson, Mr. Arthur Ernest",male,64.0,0,0,693,5229.8,New Delhi Junction (NDLS),1AC
547,1,2,"Beane, Mrs. Edward (Ethel Clarke)",female,19.0,1,0,2908,2847.62,New Delhi Junction (NDLS),2AC
548,1,2,"Padro y Manent, Mr. Julian",male,,0,0,SC/PARIS 2146,3573.05,Mumbai Central (BCT),2AC
549,0,3,"Goldsmith, Mr. Frank John",male,33.0,1,1,363291,1924.37,New Delhi Junction (NDLS),3AC
550,1,2,"Davies, Master. John Morgan Jr",male,8.0,1,1,C.A. 33112,3704.01,New Delhi Junction (NDLS),2AC
551,1,1,"Thayer, Mr. John Borland Jr",male,17.0,0,2,17421,5424.2,Mumbai Central (BCT),1AC
552,0,2,"Sharp, Mr. Percival James R",male,27.0,0,0,244358,3807.84,New Delhi Junction (NDLS),2AC
553,0,3,"O'Brien, Mr. Timothy",male,,0,0,330979,1962.29,Chennai Central (MAS),3AC
554,1,3,"Leeni, Mr. Fahim (""Philip Zenni"")",male,22.0,0,0,2620,1973.13,Mumbai Central (BCT),3AC
555,1,3,"Ohman, Miss. Velin",female,22.0,0,0,347085,2351.98,New Delhi Junction (NDLS),3AC
556,0,1,"Wright, Mr. George",male,62.0,0,0,113807,5284.18,New Delhi Junction (NDLS),1AC
557,1,1,"Duff Gordon, Lady. (Lucille Christiana Sutherland) (""Mrs Morgan"")",female,48.0,1,0,11755,4960.82,Mumbai Central (BCT),1AC
558,0,1,"Robbins, Mr. Victor",male,,0,0,PC 17757,4834.54,Mumbai Central (BCT),1AC
559,1,1,"Taussig, Mrs. Emil (Tillie Mandelbaum)",female,39.0,1,1,110413,5706.16,New Delhi Junction (NDLS),1AC
560,1,3,"de Messemaeker, Mrs. Guillaume Joseph (Emma)",female,36.0,1,0,345572,2044.37,New Delhi Junction (NDLS),3AC
561,0,3,"Morrow, Mr. Thomas Rowan",male,,0,0,372622,2144.9,Chennai Central (MAS),3AC
562,0,3,"Sivic, Mr. Husein",male,40.0,0,0,349251,1555.56,New Delhi Junction (NDLS),3AC
563,0,2,"Norman, Mr. Robert Douglas",male,28.0,0,0,218629,2877.28,New Delhi Junction (NDLS),2AC
564,0,3,"Simmons, Mr. John",male,,0,0,SOTON/OQ 392082,1317.45,New Delhi Junction (NDLS),3AC
565,0,3,"Meanwell, Miss. (Marion Ogden)",female,,0,0,SOTON/O.Q. 392087,1720.71,New Delhi Junction (NDLS),3AC
566,0,3,"Davies, Mr. Alfred J",male,24.0,2,0,A/4 48871,2007.9,New Delhi Junction (NDLS),3AC
567,0,3,"Stoytcheff, Mr. Ilia",male,19.0,0,0,349205,1770.69,New Delhi Junction (NDLS),3AC
568,0,3,"Palsson, Mrs. Nils (Alma Cornelia Berglund)",female,29.0,0,4,349909,1824.97,New Delhi Junction (NDLS),3AC
569,0,3,"Doharr, Mr. Tannous",male,,0,0,2686,2384.99,Mumbai Central (BCT),3AC
570,1,3,"Jonsson, Mr. Carl",male,32.0,0,0,350417,1717.91,New Delhi Junction (NDLS),3AC
571,1,2,"Harris, Mr. George",male,62.0,0,0,S.W./PP 752,3368.19,New Delhi Junction (NDLS),2AC
572,1,1,"Appleton, Mrs. Edward Dale (Charlotte Lamson)",female,53.0,2,0,11769,5740.38,New Delhi Junction (NDLS),1AC
573,1,1,"Flynn, Mr. John Irwin (""Irving"")",male,36.0,0,0,PC 17474,5275.85,New Delhi Junction (NDLS),1AC
574,1,3,"Kelly, Miss. Mary",female,,0,0,14312,2046.5,Chennai Central (MAS),3AC
575,0,3,"Rush, Mr. Alfred George John",male,16.0,0,0,A/4. 20589,2334.84,New Delhi Junction (NDLS),3AC
576,0,3,"Patchett, Mr. George",male,19.0,0,0,358585,2439.42,New Delhi Junction (NDLS),3AC
577,1,2,"Garside, Miss. Ethel",female,34.0,0,0,243880,2891.2,New Delhi Junction (NDLS),2AC
578,1,1,"Silvey, Mrs. William Baird (Alice Munger)",female,39.0,1,0,13507,5911.91,New Delhi Junction (NDLS),1AC
579,0,3,"Caram, Mrs. Joseph (Maria Elias)",female,,1,0,2689,1890.54,Mumbai Central (BCT),3AC
580,1,3,"Jussila, Mr. Eiriik",male,32.0,0,0,STON/O 2. 3101286,1609.89,New Delhi Junction (NDLS),3AC
581,1,2,"Christy, Miss. Julie Rachel",female,25.0,1,1,237789,3296.88,New Delhi Junction (NDLS),2AC
582,1,1,"Thayer, Mrs. John Borland (Marian Longstreth Morris)",female,39.0,1,1,17421,5976.04,Mumbai Central (BCT),1AC
583,0,2,"Downton, Mr. William James",male,54.0,0,0,28403,3340.4,New Delhi Junction (NDLS),2AC
584,0,1,"Ross, Mr. John Hugo",male,36.0,0,0,13049,5194.5,Mumbai Central (BCT),1AC
585,0,3,"Paulner, Mr. Uscher",male,,0,0,3411,2060.08,Mumbai Central (BCT),3AC
586,1,1,"Taussig, Miss. Ruth",female,18.0,0,2,110413,5088.17,New Delhi Junction (NDLS),1AC
587,0,2,"Jarvis, Mr. John Denzil",male,47.0,0,0,237565,2798.62,New Delhi Junction (NDLS),2AC
588,1,1,"Frolicher-Stehli, Mr. Maxmillian",male,60.0,1,1,13567,4954.66,Mumbai Central (BCT),1AC
589,0,3,"Gilinski, Mr. Eliezer",male,22.0,0,0,14973,1453.66,New Delhi Junction (NDLS),3AC
590,0,3,"Murdlin, Mr. Joseph",male,,0,0,A./5. 3235,1482.28,New Delhi Junction (NDLS),3AC
591,0,3,"Rintamaki, Mr. Matti",male,35.0,0,0,STON/O 2. 3101273,1466.59,New Delhi Junction (NDLS),3AC
592,1,1,"Stephenson, Mrs. Walter Bertram (Martha Eustis)",female,52.0,1,0,36947,5569.05,Mumbai Central (BCT),1AC
593,0,3,"Elsbury, Mr. William James",male,47.0,0,0,A/5 3902,1518.26,New Delhi Junction (NDLS),3AC
594,0,3,"Bourke, Miss. Mary",female,,0,2,364848,1714.8,Chennai Central (MAS),3AC
595,0,2,"Chapman, Mr. John Henry",male,37.0,1,0,SC/AH 29037,3865.82,New Delhi Junction (NDLS),2AC
596,0,3,"Van Impe, Mr. Jean Baptiste",male,36.0,1,1,345773,1868.75,New Delhi Junction (NDLS),3AC
597,1,2,"Leitch, Miss. Jessie Wills",female,,0,0,248727,3567.83,New Delhi Junction (NDLS),2AC
598,0,3,"Johnson, Mr. Alfred",male,49.0,0,0,LINE,1506.78,New Delhi Junction (NDLS),3AC
599,0,3,"Boulos, Mr. Hanna",male,,0,0,2664,1530.75,Mumbai Central (BCT),3AC
600,1,1,"Duff Gordon, Sir. Cosmo Edmund (""Mr Morgan"")",male,49.0,1,0,PC 17485,4849.04,Mumbai Central (BCT),1AC
601,1,2,"Jacobsohn, Mrs. Sidney Samuel (Amy Frances Christy)",female,24.0,2,1,243847,2919.62,New Delhi Junction (NDLS),2AC
602,0,3,"Slabenoff, Mr. Petco",male,,0,0,349214,1634.31,New Delhi Junction (NDLS),3AC
603,0,1,"Harrington, Mr. Charles H",male,,0,0,113796,5012.41,New Delhi Junction (NDLS),1AC
604,0,3,"Torber, Mr. Ernst William",male,44.0,0,0,364511,1406.44,New Delhi Junction (NDLS),3AC
605,1,1,"Homer, Mr. Harry (""Mr E Haven"")",male,35.0,0,0,111426,4944.76,Mumbai Central (BCT),1AC
606,0,3,"Lindell, Mr. Edvard Bengtsson",male,36.0,1,0,349910,1852.93,New Delhi Junction (NDLS),3AC
607,0,3,"Karaic, Mr. Milan",male,30.0,0,0,349246,1547.6,New Delhi Junction (NDLS),3AC
608,1,1,"Daniel, Mr. Robert Williams",male,27.0,0,0,113804,5237.12,New Delhi Junction (NDLS),1AC
609,1,2,"Laroche, Mrs. Joseph (Juliette Marie Louise Lafargue)",female,22.0,1,2,SC/Paris 2123,3354.44,Mumbai Central (BCT),2AC
610,1,1,"Shutes, Miss. Elizabeth W",female,40.0,0,0,PC 17582,5628.47,New Delhi Junction (NDLS),1AC
611,0,3,"Andersson, Mrs. Anders Johan (Alfrida Konstantia Brogren)",female,39.0,1,5,347082,1347.17,New Delhi Junction (NDLS),3AC
612,0,3,"Jardin, Mr. Jose Neto",male,,0,0,SOTON/O.Q. 3101305,2259.29,New Delhi Junction (NDLS),3AC
613,1,3,"Murphy, Miss. Margaret Jane",female,,1,0,367230,2053.48,Chennai Central (MAS),3AC
614,0,3,"Horgan, Mr. John",male,,0,0,370377,1398.11,Chennai Central (MAS),3AC
615,0,3,"Brocklebank, Mr. William Alfred",male,35.0,0,0,364512,2348.29,New Delhi Junction (NDLS),3AC
616,1,2,"Herman, Miss. Alice",female,24.0,1,2,220845,3897.13,New Delhi Junction (NDLS),2AC
617,0,3,"Danbom, Mr. Ernst Gilbert",male,34.0,1,1,347080,1373.29,New Delhi Junction (NDLS),3AC
618,0,3,"Lobb, Mrs. William Arthur (Cordelia K Stanlick)",female,26.0,1,0,A/5. 3336,1632.25,New Delhi Junction (NDLS),3AC
619,1,2,"Becker, Miss. Marion Louise",female,4.0,2,1,230136,3748.06,New Delhi Junction (NDLS),2AC
620,0,2,"Gavey, Mr. Lawrence",male,26.0,0,0,31028,3672.74,New Delhi Junction (NDLS),2AC
621,0,3,"Yasbeck, Mr. Antoni",male,27.0,1,0,2659,1521.43,Mumbai Central (BCT),3AC
622,1,1,"Kimball, Mr. Edwin Nelson Jr",male,42.0,1,0,11753,5051.22,New Delhi Junction (NDLS),1AC
623,1,3,"Nakid, Mr. Sahid",male,20.0,1,1,2653,1744.57,Mumbai Central (BCT),3AC
624,0,3,"Hansen, Mr. Henry Damsgaard",male,21.0,0,0,350029,1881.43,New Delhi Junction (NDLS),3AC
625,0,3,"Bowen, Mr. David John ""Dai""",male,21.0,0,0,54636,2041.91,New Delhi Junction (NDLS),3AC
626,0,1,"Sutton, Mr. Frederick",male,61.0,0,0,36963,5242.7,New Delhi Junction (NDLS),1AC
627,0,2,"Kirkland, Rev. Charles Leonard",male,57.0,0,0,219533,3301.3,Chennai Central (MAS),2AC
628,1,1,"Longley, Miss. Gretchen Fiske",female,21.0,0,0,13502,5696.97,New Delhi Junction (NDLS),1AC
629,0,3,"Bostandyeff, Mr. Guentcho",male,26.0,0,0,349224,1344.02,New Delhi Junction (NDLS),3AC
630,0,3,"O'Connell, Mr. Patrick D",male,,0,0,334912,1602.92,Chennai Central (MAS),3AC
631,1,1,"Barkworth, Mr. Algernon Henry Wilson",male,80.0,0,0,27042,5656.02,New Delhi Junction (NDLS),1AC
632,0,3,"Lundahl, Mr. Johan Svensson",male,51.0,0,0,347743,2374.25,New Delhi Junction (NDLS),3AC
633,1,1,"Stahelin-Maeglin, Dr. Max",male,32.0,0,0,13214,5414.01,Mumbai Central (BCT),1AC
634,0,1,"Parr, Mr. William Henry Marsh",male,,0,0,112052,5438.54,New Delhi Junction (NDLS),1AC
635,0,3,"Skoog, Miss. Mabel",female,9.0,3,2,347088,1428.61,New Delhi Junction (NDLS),3AC
636,1,2,"Davis, Miss. Mary",female,28.0,0,0,237668,3281.64,New Delhi Junction (NDLS),2AC
637,0,3,"Leinonen, Mr. Antti Gustaf",male,32.0,0,0,STON/O 2. 3101292,1939.14,New Delhi Junction (NDLS),3AC
638,0,2,"Collyer, Mr. Harvey",male,31.0,1,1,C.A. 31921,3015.21,New Delhi Junction (NDLS),2AC
639,0,3,"Panula, Mrs. Juha (Maria Emilia Ojala)",female,41.0,0,5,3101295,1623.09,New Delhi Junction (NDLS),3AC
640,0,3,"Thorneycroft, Mr. Percival",male,,1,0,376564,1752.74,New Delhi Junction (NDLS),3AC
641,0,3,"Jensen, Mr. Hans Peder",male,20.0,0,0,350050,1324.09,New Delhi Junction (NDLS),3AC
642,1,1,"Sagesser, Mlle. Emma",female,24.0,0,0,PC 17477,5186.49,Mumbai Central (BCT),1AC
643,0,3,"Skoog, Miss. Margit Elizabeth",female,2.0,3,2,347088,1553.74,New Delhi Junction (NDLS),3AC
644,1,3,"Foo, Mr. Choong",male,,0,0,1601,1693.0,New Delhi Junction (NDLS),3AC
645,1,3,"Baclini, Miss. Eugenie",female,0.75,2,1,2666,1443.71,Mumbai Central (BCT),3AC
646,1,1,"Harper, Mr. Henry Sleeper",male,48.0,1,0,PC 17572,5868.63,Mumbai Central (BCT),1AC
647,0,3,"Cor, Mr. Liudevit",male,19.0,0,0,349231,2012.31,New Delhi Junction (NDLS),3AC
648,1,1,"Simonius-Blumer, Col. Oberst Alfons",male,56.0,0,0,13213,5614.92,Mumbai Central (BCT),1AC
649,0,3,"Willey, Mr. Edward",male,,0,0,S.O./P.P. 751,2247.01,New Delhi Junction (NDLS),3AC
650,1,3,"Stanley, Miss. Amy Zillah Elsie",female,23.0,0,0,CA. 2314,1898.13,New Delhi Junction (NDLS),3AC
651,0,3,"Mitkoff, Mr. Mito",male,,0,0,349221,1404.3,New Delhi Junction (NDLS),3AC
652,1,2,"Doling, Miss. Elsie",female,18.0,0,1,231919,3398.24,New Delhi Junction (NDLS),2AC
653,0,3,"Kalvik, Mr. Johannes Halvorsen",male,21.0,0,0,8475,2004.21,New Delhi Junction (NDLS),3AC
654,1,3,"O'Leary, Miss. Hanora ""Norah""",female,,0,0,330919,2194.53,Chennai Central (MAS),3AC
655,0,3,"Hegarty, Miss. Hanora ""Nora""",female,18.0,0,0,365226,1817.99,Chennai Central (MAS),3AC
656,0,2,"Hickman, Mr. Leonard Mark",male,24.0,2,0,S.O.C. 14879,2865.85,New Delhi Junction (NDLS),2AC
657,0,3,"Radeff, Mr. Alexander",male,,0,0,349223,1640.53,New Delhi Junction (NDLS),3AC
658,0,3,"Bourke, Mrs. John (Catherine)",female,32.0,1,1,364849,1735.7,Chennai Central (MAS),3AC
659,0,2,"Eitemiller, Mr. George Floyd",male,23.0,0,0,29751,3539.69,New Delhi Junction (NDLS),2AC
660,0,1,"Newell, Mr. Arthur Webster",male,58.0,0,2,35273,5484.93,Mumbai Central (BCT),1AC
661,1,1,"Frauenthal, Dr. Henry William",male,50.0,2,0,PC 17611,5227.32,New Delhi Junction (NDLS),1AC
662,0,3,"Badt, Mr. Mohamed",male,40.0,0,0,2623,2483.82,Mumbai Central (BCT),3AC
663,0,1,"Colley, Mr. Edward Pomeroy",male,47.0,0,0,5727,5526.93,New Delhi Junction (NDLS),1AC
664,0,3,"Coleff, Mr. Peju",male,36.0,0,0,349210,1584.67,New Delhi Junction (NDLS),3AC
665,1,3,"Lindqvist, Mr. Eino William",male,20.0,1,0,STON/O 2. 3101285,1422.14,New Delhi Junction (NDLS),3AC
666,0,2,"Hickman, Mr. Lewis",male,32.0,2,0,S.O.C. 14879,2898.72,New Delhi Junction (NDLS),2AC
667,0,2,"Butler, Mr. Reginald Fenton",male,25.0,0,0,234686,3019.75,New Delhi Junction (NDLS),2AC
668,0,3,"Rommetvedt, Mr. Knud Paust",male,,0,0,312993,1492.82,New Delhi Junction (NDLS),3AC
669,0,3,"Cook, Mr. Jacob",male,43.0,0,0,A/5 3536,1523.88,New Delhi Junction (NDLS),3AC
670,1,1,"Taylor, Mrs. Elmer Zebley (Juliet Cummins Wright)",female,,1,0,19996,5142.11,New Delhi Junction (NDLS),1AC
671,1,2,"Brown, Mrs. Thomas William Solomon (Elizabeth Catherine Ford)",female,40.0,1,1,29750,2925.39,New Delhi Junction (NDLS),2AC
672,0,1,"Davidson, Mr. Thornton",male,31.0,1,0,F.C. 12750,5876.12,New Delhi Junction (NDLS),1AC
673,0,2,"Mitchell, Mr. Henry Michael",male,70.0,0,0,C.A. 24580,2804.3,New Delhi Junction (NDLS),2AC
674,1,2,"Wilhelms, Mr. Charles",male,31.0,0,0,244270,3381.86,New Delhi Junction (NDLS),2AC
675,0,2,"Watson, Mr. Ennis Hastings",male,,0,0,239856,3233.52,New Delhi Junction (NDLS),2AC
676,0,3,"Edvardsson, Mr. Gustaf Hjalmar",male,18.0,0,0,349912,2478.85,New Delhi Junction (NDLS),3AC
677,0,3,"Sawyer, Mr. Frederick Charles",male,24.5,0,0,342826,1434.45,New Delhi Junction (NDLS),3AC
678,1,3,"Turja, Miss. Anna Sofia",female,18.0,0,0,4138,1777.43,New Delhi Junction (NDLS),3AC
679,0,3,"Goodwin, Mrs. Frederick (Augusta Tyler)",female,43.0,1,6,CA 2144,2463.36,New Delhi Junction (NDLS),3AC
680,1,1,"Cardeza, Mr. Thomas Drake Martinez",male,36.0,0,1,PC 17755,5838.61,Mumbai Central (BCT),1AC
681,0,3,"Peters, Miss. Katie",female,,0,0,330935,2280.49,Chennai Central (MAS),3AC
682,1,1,"Hassab, Mr. Hammad",male,27.0,0,0,PC 17572,5109.48,Mumbai Central (BCT),1AC
683,0,3,"Olsvigen, Mr. Thor Anderson",male,20.0,0,0,6563,1505.07,New Delhi Junction (NDLS),3AC
684,0,3,"Goodwin, Mr. Charles Edward",male,14.0,5,2,CA 2144,2102.37,New Delhi Junction (NDLS),3AC
685,0,2,"Brown, Mr. Thomas William Solomon",male,60.0,1,1,29750,3908.19,New Delhi Junction (NDLS),2AC
686,0,2,"Laroche, Mr. Joseph Philippe Lemercier",male,25.0,1,2,SC/Paris 2123,3423.79,Mumbai Central (BCT),2AC
687,0,3,"Panula, Mr. Jaako Arnold",male,14.0,4,1,3101295,1985.94,New Delhi Junction (NDLS),3AC
688,0,3,"Dakic, Mr. Branko",male,19.0,0,0,349228,1635.97,New Delhi Junction (NDLS),3AC
689,0,3,"Fischer, Mr. Eberhard Thelander",male,18.0,0,0,350036,2223.39,New Delhi Junction (NDLS),3AC
690,1,1,"Madill, Miss. Georgette Alexandra",female,15.0,0,1,24160,5024.45,New Delhi Junction (NDLS),1AC
691,1,1,"Dick, Mr. Albert Adrian",male,31.0,1,0,17474,5188.42,New Delhi Junction (NDLS),1AC
692,1,3,"Karun, Miss. Manca",female,4.0,0,1,349256,1810.52,Mumbai Central (BCT),3AC
693,1,3,"Lam, Mr. Ali",male,,0,0,1601,1909.13,New Delhi Junction (NDLS),3AC
694,0,3,"Saad, Mr. Khalil",male,25.0,0,0,2672,1590.89,Mumbai Central (BCT),3AC
695,0,1,"Weir, Col. John",male,60.0,0,0,113800,4937.8,New Delhi Junction (NDLS),1AC
696,0,2,"Chapman, Mr. Charles Henry",male,52.0,0,0,248731,3493.81,New Delhi Junction (NDLS),2AC
697,0,3,"Kelly, Mr. James",male,44.0,0,0,363592,1646.36,New Delhi Junction (NDLS),3AC
698,1,3,"Mullens, Miss. Katherine ""Katie""",female,,0,0,35852,1997.49,Chennai Central (MAS),3AC
699,0,1,"Thayer, Mr. John Borland",male,49.0,1,1,17421,4985.24,Mumbai Central (BCT),1AC
700,0,3,"Humblen, Mr. Adolf Mathias Nicolai Olsen",male,42.0,0,0,348121,1877.37,New Delhi Junction (NDLS),3AC
701,1,1,"Astor, Mrs. John Jacob (Madeleine Talmadge Force)",female,18.0,1,0,PC 17757,5439.11,Mumbai Central (BCT),1AC
702,1,1,"Silverthorne, Mr. Spencer Victor",male,35.0,0,0,PC 17475,4862.19,New Delhi Junction (NDLS),1AC
703,0,3,"Barbara, Miss. Saiide",female,18.0,0,1,2691,1703.93,Mumbai Central (BCT),3AC
704,0,3,"Gallagher, Mr. Martin",male,25.0,0,0,36864,1461.3,Chennai Central (MAS),3AC
705,0,3,"Hansen, Mr. Henrik Juul",male,26.0,1,0,350025,1376.05,New Delhi Junction (NDLS),3AC
706,0,2,"Morley, Mr. Henry Samuel (""Mr Henry Marshall"")",male,39.0,0,0,250655,3986.95,New Delhi Junction (NDLS),2AC
707,1,2,"Kelly, Mrs. Florence ""Fannie""",female,45.0,0,0,223596,3119.06,New Delhi Junction (NDLS),2AC
708,1,1,"Calderhead, Mr. Edward Pennington",male,42.0,0,0,PC 17476,5771.85,New Delhi Junction (NDLS),1AC
709,1,1,"Cleaver, Miss. Alice",female,22.0,0,0,113781,5105.57,New Delhi Junction (NDLS),1AC
710,1,3,"Moubarek, Master. Halim Gonios (""William George"")",male,,1,1,2661,2117.8,Mumbai Central (BCT),3AC
711,1,1,"Mayne, Mlle. Berthe Antonine (""Mrs de Villiers"")",female,24.0,0,0,PC 17482,5712.27,Mumbai Central (BCT),1AC
712,0,1,"Klaber, Mr. Herman",male,,0,0,113028,5514.77,New Delhi Junction (NDLS),1AC
713,1,1,"Taylor, Mr. Elmer Zebley",male,48.0,1,0,19996,5365.89,New Delhi Junction (NDLS),1AC
714,0,3,"Larsson, Mr. August Viktor",male,29.0,0,0,7545,1794.21,New Delhi Junction (NDLS),3AC
715,0,2,"Greenberg, Mr. Samuel",male,52.0,0,0,250647,3153.53,New Delhi Junction (NDLS),2AC
716,0,3,"Soholt, Mr. Peter Andreas Lauritz Andersen",male,19.0,0,0,348124,2415.43,New Delhi Junction (NDLS),3AC
717,1,1,"Endres, Miss. Caroline Louise",female,38.0,0,0,PC 17757,5796.74,Mumbai Central (BCT),1AC
718,1,2,"Troutt, Miss. Edwina Celia ""Winnie""",female,27.0,0,0,34218,3954.53,New Delhi Junction (NDLS),2AC
719,0,3,"McEvoy, Mr. Michael",male,,0,0,36568,1449.16,Chennai Central (MAS),3AC
720,0,3,"Johnson, Mr. Malkolm Joackim",male,33.0,0,0,347062,2177.04,New Delhi Junction (NDLS),3AC
721,1,2,"Harper, Miss. Annie Jessie ""Nina""",female,6.0,0,1,248727,3919.84,New Delhi Junction (NDLS),2AC
722,0,3,"Jensen, Mr. Svend Lauritz",male,17.0,1,0,350048,1517.48,New Delhi Junction (NDLS),3AC
723,0,2,"Gillespie, Mr. William Henry",male,34.0,0,0,12233,2786.45,New Delhi Junction (NDLS),2AC
724,0,2,"Hodges, Mr. Henry Price",male,50.0,0,0,250643,3663.46,New Delhi Junction (NDLS),2AC
725,1,1,"Chambers, Mr. Norman Campbell",male,27.0,1,0,113806,5489.37,New Delhi Junction (NDLS),1AC
726,0,3,"Oreskovic, Mr. Luka",male,20.0,0,0,315094,2310.19,New Delhi Junction (NDLS),3AC
727,1,2,"Renouf, Mrs. Peter Henry (Lillian Jefferys)",female,30.0,3,0,31027,2881.7,New Delhi Junction (NDLS),2AC
728,1,3,"Mannion, Miss. Margareth",female,,0,0,36866,2254.32,Chennai Central (MAS),3AC
729,0,2,"Bryhl, Mr. Kurt Arnold Gottfrid",male,25.0,1,0,236853,2962.12,New Delhi Junction (NDLS),2AC
730,0,3,"Ilmakangas, Miss. Pieta Sofia",female,25.0,1,0,STON/O2. 3101271,1496.39,New Delhi Junction (NDLS),3AC
731,1,1,"Allen, Miss. Elisabeth Walton",female,29.0,0,0,24160,4997.12,New Delhi Junction (NDLS),1AC
732,0,3,"Hassan, Mr. Houssein G N",male,11.0,0,0,2699,2277.49,Mumbai Central (BCT),3AC
733,0,2,"Knight, Mr. Robert J",male,,0,0,239855,3564.76,New Delhi Junction (NDLS),2AC
734,0,2,"Berriman, Mr. William John",male,23.0,0,0,28425,3379.99,New Delhi Junction (NDLS),2AC
735,0,2,"Troupiansky, Mr. Moses Aaron",male,23.0,0,0,233639,3166.48,New Delhi Junction (NDLS),2AC
736,0,3,"Williams, Mr. Leslie",male,28.5,0,0,54636,2352.64,New Delhi Junction (NDLS),3AC
737,0,3,"Ford, Mrs. Edward (Margaret Ann Watson)",female,48.0,1,3,W./C. 6608,1770.93,New Delhi Junction (NDLS),3AC
738,1,1,"Lesurer, Mr. Gustave J",male,35.0,0,0,PC 17755,5779.92,Mumbai Central (BCT),1AC
739,0,3,"Ivanoff, Mr. Kanio",male,,0,0,349201,1826.96,New Delhi Junction (NDLS),3AC
740,0,3,"Nankoff, Mr. Minko",male,,0,0,349218,1752.33,New Delhi Junction (NDLS),3AC
741,1,1,"Hawksford, Mr. Walter James",male,,0,0,16988,5355.22,New Delhi Junction (NDLS),1AC
742,0,1,"Cavendish, Mr. Tyrell William",male,36.0,1,0,19877,5161.65,New Delhi Junction (NDLS),1AC
743,1,1,"Ryerson, Miss. Susan Parker ""Suzette""",female,21.0,2,2,PC 17608,5697.13,Mumbai Central (BCT),1AC
744,0,3,"McNamee, Mr. Neal",male,24.0,1,0,376566,1903.26,New Delhi Junction (NDLS),3AC
745,1,3,"Stranden, Mr. Juho",male,31.0,0,0,STON/O 2. 3101288,1578.66,New Delhi Junction (NDLS),3AC
746,0,1,"Crosby, Capt. Edward Gifford",male,70.0,1,1,WE/P 5735,5879.49,New Delhi Junction (NDLS),1AC
747,0,3,"Abbott, Mr. Rossmore Edward",male,16.0,1,1,C.A. 2673,1760.67,New Delhi Junction (NDLS),3AC
748,1,2,"Sinkkonen, Miss. Anna",female,30.0,0,0,250648,3406.62,New Delhi Junction (NDLS),2AC
749,0,1,"Marvin, Mr. Daniel Warner",male,19.0,1,0,113773,5887.77,New Delhi Junction (NDLS),1AC
750,0,3,"Connaghton, Mr. Michael",male,31.0,0,0,335097,2049.09,Chennai Central (MAS),3AC
751,1,2,"Wells, Miss. Joan",female,4.0,1,1,29103,2851.97,New Delhi Junction (NDLS),2AC
752,1,3,"Moor, Master. Meier",male,6.0,0,1,392096,2427.8,New Delhi Junction (NDLS),3AC
753,0,3,"Vande Velde, Mr. Johannes Joseph",male,33.0,0,0,345780,2053.25,New Delhi Junction (NDLS),3AC
754,0,3,"Jonkoff, Mr. Lalio",male,23.0,0,0,349204,1701.89,New Delhi Junction (NDLS),3AC
755,1,2,"Herman, Mrs. Samuel (Jane Laver)",female,48.0,1,2,220845,2881.05,New Delhi Junction (NDLS),2AC
756,1,2,"Hamalainen, Master. Viljo",male,0.67,1,1,250649,3732.23,New Delhi Junction (NDLS),2AC
757,0,3,"Carlsson, Mr. August Sigfrid",male,28.0,0,0,350042,2044.09,New Delhi Junction (NDLS),3AC
758,0,2,"Bailey, Mr. Percy Andrew",male,18.0,0,0,29108,3393.5,New Delhi Junction (NDLS),2AC
759,0,3,"Theobald, Mr. Thomas Leonard",male,34.0,0,0,363294,2372.67,New Delhi Junction (NDLS),3AC
760,1,1,"Rothes, the Countess. of (Lucy Noel Martha Dyer-Edwards)",female,33.0,0,0,110152,5746.32,New Delhi Junction (NDLS),1AC
761,0,3,"Garfirth, Mr. John",male,,0,0,358585,1482.01,New Delhi Junction (NDLS),3AC
762,0,3,"Nirva, Mr. Iisakki Antino Aijo",male,41.0,0,0,SOTON/O2 3101272,1674.07,New Delhi Junction (NDLS),3AC
763,1,3,"Barah, Mr. Hanna Assi",male,20.0,0,0,2663,1598.19,Mumbai Central (BCT),3AC
764,1,1,"Carter, Mrs. William Ernest (Lucile Polk)",female,36.0,1,2,113760,5692.74,New Delhi Junction (NDLS),1AC
765,0,3,"Eklund, Mr. Hans Linus",male,16.0,0,0,347074,1340.24,New Delhi Junction (NDLS),3AC
766,1,1,"Hogeboom, Mrs. John C (Anna Andrews)",female,51.0,1,0,13502,5483.87,New Delhi Junction (NDLS),1AC
767,0,1,"Brewe, Dr. Arthur Jackson",male,,0,0,112379,5714.95,Mumbai Central (BCT),1AC
768,0,3,"Mangan, Miss. Mary",female,30.5,0,0,364850,2352.12,Chennai Central (MAS),3AC
769,0,3,"Moran, Mr. Daniel J",male,,1,0,371110,1710.5,Chennai Central (MAS),3AC
770,0,3,"Gronnestad, Mr. Daniel Danielsen",male,32.0,0,0,8471,2285.51,New Delhi Junction (NDLS),3AC
771,0,3,"Lievens, Mr. Rene Aime",male,24.0,0,0,345781,1432.76,New Delhi Junction (NDLS),3AC
772,0,3,"Jensen, Mr. Niels Peder",male,48.0,0,0,350047,2315.74,New Delhi Junction (NDLS),3AC
773,0,2,"Mack, Mrs. (Mary)",female,57.0,0,0,S.O./P.P. 3,2865.74,New Delhi Junction (NDLS),2AC
774,0,3,"Elias, Mr. Dibo",male,,0,0,2674,1776.74,Mumbai Central (BCT),3AC
775,1,2,"Hocking, Mrs. Elizabeth (Eliza Needs)",female,54.0,1,3,29105,3736.48,New Delhi Junction (NDLS),2AC
776,0,3,"Myhrman, Mr. Pehr Fabian Oliver Malkolm",male,18.0,0,0,347078,1479.9,New Delhi Junction (NDLS),3AC
777,0,3,"Tobin, Mr. Roger",male,,0,0,383121,1575.1,Chennai Central (MAS),3AC
778,1,3,"Emanuel, Miss. Virginia Ethel",female,5.0,0,0,364516,2166.7,New Delhi Junction (NDLS),3AC
779,0,3,"Kilgannon, Mr. Thomas J",male,,0,0,36865,2164.04,Chennai Central (MAS),3AC
780,1,1,"Robert, Mrs. Edward Scott (Elisabeth Walton McMillan)",female,43.0,0,1,24160,5569.38,New Delhi Junction (NDLS),1AC
781,1,3,"Ayoub, Miss. Banoura",female,13.0,0,0,2687,2132.74,Mumbai Central (BCT),3AC
782,1,1,"Dick, Mrs. Albert Adrian (Vera Gillespie)",female,17.0,1,0,17474,5451.27,New Delhi Junction (NDLS),1AC
783,0,1,"Long, Mr. Milton Clyde",male,29.0,0,0,113501,5102.16,New Delhi Junction (NDLS),1AC
784,0,3,"Johnston, Mr. Andrew G",male,,1,2,W./C. 6607,1714.84,New Delhi Junction (NDLS),3AC
785,0,3,"Ali, Mr. William",male,25.0,0,0,SOTON/O.Q. 3101312,1517.92,New Delhi Junction (NDLS),3AC
786,0,3,"Harmer, Mr. Abraham (David Lishin)",male,25.0,0,0,374887,2390.14,New Delhi Junction (NDLS),3AC
787,1,3,"Sjoblom, Miss. Anna Sofia",female,18.0,0,0,3101265,2000.07,New Delhi Junction (NDLS),3AC
788,0,3,"Rice, Master. George Hugh",male,8.0,4,1,382652,1781.02,Chennai Central (MAS),3AC
789,1,3,"Dean, Master. Bertram Vere",male,1.0,1,2,C.A. 2315,1854.41,New Delhi Junction (NDLS),3AC
790,0,1,"Guggenheim, Mr. Benjamin",male,46.0,0,0,PC 17593,5936.74,Mumbai Central (BCT),1AC
791,0,3,"Keane, Mr. Andrew ""Andy""",male,,0,0,12460,1484.02,Chennai Central (MAS),3AC
792,0,2,"Gaskell, Mr. Alfred",male,16.0,0,0,239865,3462.1,New Delhi Junction (NDLS),2AC
793,0,3,"Sage, Miss. Stella Anna",female,,8,2,CA. 2343,1907.07,New Delhi Junction (NDLS),3AC
794,0,1,"Hoyt, Mr. William Fisher",male,,0,0,PC 17600,5533.75,Mumbai Central (BCT),1AC
795,0,3,"Dantcheff, Mr. Ristiu",male,25.0,0,0,349203,1321.73,New Delhi Junction (NDLS),3AC
796,0,2,"Otter, Mr. Richard",male,39.0,0,0,28213,3833.76,New Delhi Junction (NDLS),2AC
797,1,1,"Leader, Dr. Alice (Farnham)",female,49.0,0,0,17465,5918.54,New Delhi Junction (NDLS),1AC
798,1,3,"Osman, Mrs. Mara",female,31.0,0,0,349244,1978.16,New Delhi Junction (NDLS),3AC
799,0,3,"Ibrahim Shawah, Mr. Yousseff",male,30.0,0,0,2685,2135.98,Mumbai Central (BCT),3AC
800,0,3,"Van Impe, Mrs. Jean Baptiste (Rosalie Paula Govaert)",female,30.0,1,1,345773,2407.0,New Delhi Junction (NDLS),3AC
801,0,2,"Ponesell, Mr. Martin",male,34.0,0,0,250647,3619.41,New Delhi Junction (NDLS),2AC
802,1,2,"Collyer, Mrs. Harvey (Charlotte Annie Tate)",female,31.0,1,1,C.A. 31921,2898.3,New Delhi Junction (NDLS),2AC
803,1,1,"Carter, Master. William Thornton II",male,11.0,1,2,113760,5491.55,New Delhi Junction (NDLS),1AC
804,1,3,"Thomas, Master. Assad Alexander",male,0.42,0,1,2625,2028.06,Mumbai Central (BCT),3AC
805,1,3,"Hedman, Mr. Oskar Arvid",male,27.0,0,0,347089,1808.96,New Delhi Junction (NDLS),3AC
806,0,3,"Johansson, Mr. Karl Johan",male,31.0,0,0,347063,2183.73,New Delhi Junction (NDLS),3AC
807,0,1,"Andrews, Mr. Thomas Jr",male,39.0,0,0,112050,5921.24,New Delhi Junction (NDLS),1AC
